,Keyword
7200,good quality king size beds
7201,mattress comparison
7202,can a mattress cause back pain
7203,is gel or memory foam better
7204,is gel or memory foam better
7205,what's the difference between twin and full
7206,will washing sheets get rid of bed bugs
7207,the width of a twin bed
7208,how to break in memory foam pillow
7209,skid bed frame
7210,top mattresses for kids
7211,mattress with least off gassing
7212,are memory foam mattresses good
7213,green memory foam pillow
7214,calories burned during day on average
7215,which foam mattress
7216,twin size vs full size
7217,is a twin xl a full
7218,best way to store a mattress
7219,how much calories does my body burn naturally
7220,pocket spring or memory foam mattress
7221,how to sleep on a memory foam mattress
7222,air mattress with adjustable base
7223,what is the best mattress for side sleepers
7224,how to fold up a metal futon bed
7225,amerisleep as3 financing
7226,60 inch mattress size
7227,sleep paralysis happens every night
7228,best in the box mattress
7229,do 2 twin beds make a king
7230,how to fix a lumpy mattress
7231,plushbeds latex mattress topper
7232,bed bigger than cal king
7233,bed bigger than cal king
7234,zen bamboo mattress protector
7235,no memory foam mattress
7236,best bed on the market 2019
7237,mattress topper free trial
7238,should i stay up all night to fix sleep schedule
7239,luxe hybrid mattress
7240,metal bed frame lifts
7241,are pillow top mattresses the best
7242,king mattress cost
7243,how do you keep a futon mattress from slipping down
7244,why sleep paralysis is good
7245,what is the length of a king size bed
7246,standard length of twin size bed
7247,how to check a used mattress for bed bugs
7248,layla kapok memory foam pillow
7249,wake up on a saturday night
7250,california king thermal blanket
7251,memory foam mattress do you need box spring
7252,how to make old mattress feel new
7253,what's the length and width of a king size bed
7254,is a twin bed big enough for a teenager
7255,is a twin bed big enough for a teenager
7256,spring mattress vs foam mattress vs latex mattress
7257,lumpy comforter
7258,cheap mattress options
7259,for a queen size bed
7260,will a full size mattress fit a twin frame
7261,king sized bed size
7262,which mattress is firmest
7263,dunlop foam mattress topper
7264,what type of bed is good for back problems
7265,the best memory foam mattress topper
7266,most comfortable firm pillow
7267,best mattress for spinal stenosis
7268,mattress topper on box spring
7269,best mattress for side sleepers and lower back pain
7270,hypoallergenic bed toppers
7271,best firm full mattress
7272,firm bed better for back
7273,best quality mattress price
7274,best memory foam topper to buy
7275,full bed length
7276,how to measure a pillow size
7277,can a twin fit a twin xl
7278,california king cooling mattress topper
7279,can bed bugs live in memory foam mattresses
7280,what's the size of a twin size bed
7281,how to find mattress size
7282,is full and queen the same size
7283,do you need a foundation with an adjustable bed frame
7284,rem sleep paralysis
7285,full size adjustable mattress
7286,why do we sweat in our sleep
7287,smart flex adjustable bed reviews
7288,best matress cleaner
7289,pillow wont dry in dryer
7290,cool sleep memory foam pillow
7291,ways to get your sleep schedule back on track
7292,what works best to get rid of bed bugs
7293,triethylene glycol sleep
7294,extra firm mattress topper review
7295,who sells california queen mattresses
7296,bedroom fit for a king and queen
7297,how to dry pillows in dryer
7298,make your own mattress topper
7299,cutting up a memory foam mattress
7300,hip pain while sleeping
7301,which mattress in a box is best
7302,west elm weighted blanket
7303,best firm pillow for side sleepers
7304,whats latex
7305,how to dry your pillows
7306,standard mattress dimensions
7307,mattress compare website
7308,difference between twin and full size bed
7309,what is the best mattress to buy
7310,what is mattress pad and mattress topper
7311,hydrogen peroxide stain removal mattress
7312,queen size bed 5 feet
7313,the hive mattress
7314,sleep country adjustable beds cost
7315,what are the dimensions of a single size mattress
7316,how much wider is a king than a queen mattress
7317,how to turn two twins into a king mattress
7318,size of twin bed vs queen
7319,best 3 inch mattress topper
7320,good memory foam pillows
7321,best mattress and box springs
7322,how to stop kids from grinding teeth
7323,split king power adjustable base
7324,14 inch futon mattress
7325,viscosoft 4 inch gel memory foam mattress topper
7326,sanitize pillows in the sun
7327,standard king size
7328,natural form mattress reviews
7329,best down alternative mattress topper
7330,best mattress for heavy
7331,how to make mattress at home
7332,coloroll memory foam pillow
7333,how to wash pillows in washer
7334,large queen size bed
7335,how to clean mold from tempur pedic mattress
7336,amazon mint mattress
7337,what is the best pillow to sleep on
7338,how big is a king size comforter
7339,sleep fine mattress online
7340,average pillow size
7341,best thick pillows
7342,is a full bigger than a twin
7343,how much calories do you need
7344,what's the difference between a twin and full size bed
7345,how to fix a lumpy pillow top mattress
7346,best cheap mattress for back pain
7347,should i buy a latex mattress
7348,used queen adjustable bed frame
7349,amerisleep bed in a box
7350,best toddler twin mattress 2019
7351,twin xl adjustable bed
7352,difference between california king and regular king mattress
7353,bigger size bed than king
7354,how big is queen size
7355,split king xl sheets
7356,plushbeds latex pillow
7357,flex top king bed
7358,firm innerspring mattress
7359,top memory foam mattress 2020
7360,baking soda vs bed bugs
7361,clean and dry foam wash use
7362,best deals on futon beds
7363,is gel memory foam mattress good for your back
7364,mattress topper for soft mattress
7365,washing pillows
7366,extra large twin bed dimensions
7367,best pocket sprung mattress for side sleepers
7368,best mattress without box spring
7369,how to choose a futon
7370,how often should you replace your mattress
7371,my temp cooling mattress pad
7372,how to clean a king size comforter
7373,living spaces twin bed
7374,best sleeping position for curved spine
7375,chilipad twin xl
7376,how long can u stay awake
7377,best sleeping position for hip pain
7378,what is the difference between king and california king sheets
7379,how many years does a memory foam mattress last
7380,queen king size
7381,sleep pro mattress reviews
7382,2020 best mattress
7383,very comfortable futon
7384,shower in morning or night
7385,split king size bed frame
7386,split king size bed frame
7387,soft mattress causing back pain
7388,adjustable bed mattress queen
7389,california king inches
7390,california king inches
7391,can you put diatomaceous earth on your mattress
7392,double bed dimensions in feet
7393,two king size beds together
7394,twin xl bed compared to full
7395,coop pillow filling
7396,is there a difference between a full and double bed
7397,hip pain in bed
7398,best full mattress for teenager
7399,pillow top cooling mattress
7400,memory foam mattress for heavy people
7401,bed frame for king size adjustable bed
7402,king size bed and mattress package
7403,length of full bed vs queen
7404,twin size blanket dimensions in inches
7405,california king size bed dimensions usa
7406,will king sheets fit a cali king
7407,60 inch tall loft beds
7408,best stiff mattress
7409,is latex mattress good for health
7410,typical mattress warranty
7411,super king size futon
7412,down pillow smells after washing
7413,best bed for couples with different firmness
7414,how wide is a standard twin bed mattress
7415,do i need bed frame with boxspring
7416,what's the difference between king and queen bed
7417,what's the difference between king and queen bed
7418,iso cool mattress topper
7419,hips and curves customer reviews
7420,what size is a king bed in inches
7421,how old is your mattress
7422,how much does a king size mattress cost
7423,bed frame back support
7424,length and width of queen bed
7425,whats the difference between king and queen
7426,whats the difference between king and queen
7427,best medium firm innerspring mattress
7428,best pillow for side sleeper with allergies
7429,futon queen size dimensions
7430,how to make waking up easier
7431,what makes a bed
7432,measurements of a cal king
7433,measurements of a cal king
7434,which latex mattress is best
7435,futon cushion only
7436,memory foam headboard
7437,innerspring
7438,how often change bed mattress
7439,bamboo bed topper
7440,cm of queen size bed
7441,alaskan king mattress for sale
7442,self editor's choice cooling gel infused memory foam mattress topper
7443,innerspring mattress vs pocket spring
7444,how long is a twin bed
7445,calories burned in sleep calculator
7446,mattress with cooling fan
7447,best duvet insert for hot sleepers
7448,best memory foam toddler mattress
7449,double bed with 2 separate mattresses
7450,how to stop drooling when you sleep
7451,how big is a alaskan king bed
7452,certified sleep science coach
7453,twin and full size bed difference
7454,california king or king bigger
7455,california king or king bigger
7456,full size mattress size measurements
7457,does staying up all night burn calories
7458,king adjustable base with massage
7459,how to get rid of stains on bed mattress
7460,tulo firm mattress review
7461,how to stop sleep paralysis when it happens
7462,extra long queen size bed
7463,sleep on latex mattress topper reviews
7464,how to cut latex mattress
7465,how can i stop grinding and clenching my teeth
7466,hybrid innerspring mattress
7467,types of pillow shapes
7468,metal bed frame for memory foam mattress
7469,best bed for night sweats
7470,whats the best mattress for a side sleeper
7471,whats the best mattress for a side sleeper
7472,difference between innerspring and memory foam mattress
7473,shikibuton cotton mat
7474,what is a normal sleep schedule
7475,do two twin beds make a full size bed
7476,best reasonably priced mattress
7477,firm feel mattress
7478,cooling mattress protector twin xl
7479,what is dunlop latex
7480,how many calories do you burn when you make out
7481,how can you firm up a mattress
7482,best mattress cover for hot sleepers
7483,full bed dimensions compared to queen
7484,best matress on a budget
7485,best mattress for heavy back sleepers
7486,really comfortable futon
7487,how big of a washer for king size comforter
7488,moving a king mattress
7489,off gassing of mattresses
7490,spilled tea on mattress
7491,king size hybrid mattress
7492,how long should you replace your mattress
7493,how large is a full mattress
7494,low cost foam mattress
7495,memory foam mattress frame
7496,queen size mattress size inches
7497,split mattress topper
7498,standard twin size bed frame dimensions
7499,air flow mattress topper
7500,memory foam pillow manufacturers
7501,when to replace pillows
7502,how much does a california king size bed cost
7503,tulo reviews
7504,best bed for lower back problems
7505,is a twin bigger than a full
7506,best mattress of 2019
7507,how to clean sweat from mattress
7508,best mattress sales
7509,best way to clean down pillows
7510,firm mattress causing back pain
7511,avocado latex mattress
7512,how to clean mold off foam mattress
7513,shredded vs solid memory foam pillow
7514,mattress soft on one side and firm on the other
7515,optimal sleep calculator
7516,how to get someone to stop grinding teeth at night
7517,what type of bed for back pain
7518,is 8 inch mattress enough
7519,ratchet strap mattress to car
7520,bed dimensions in inches
7521,how to clean my pillow
7522,used latex mattress for sale
7523,do new mattresses require box springs
7524,how many calories can you burn in an hour
7525,california king difference between king mattress
7526,do regular twin sheets fit twin xl
7527,bed size smaller than twin
7528,are firm beds better for your back
7529,cleaning sweat stains from pillows
7530,what to put under mattress on platform bed
7531,alaskan king bed retailers
7532,back to back sleeping
7533,non foam mattress topper
7534,top king size mattress reviews
7535,are gel memory foam mattress toppers good
7536,king size dimensions in feet
7537,what is memory mattress
7538,how to tell if mattress is sagging
7539,difference between california king and regular
7540,difference between california king and regular
7541,best affordable mattress for back pain
7542,does showering at night help you sleep
7543,zen bamboo mattress topper review
7544,how is memory foam made
7545,king bed dimensions cm
7546,foam mattress base
7547,best coil and memory foam mattress
7548,how much calories burn without exercise
7549,how many calories we burn in a day
7550,how to make a split king bed
7551,sleeping on ur back
7552,why does my stomach feel like a waterbed
7553,alaskan king bed purchase
7554,pillow stains
7555,how much to dry clean a down comforter
7556,reclining bed frame king
7557,high quality king size mattress
7558,how much bigger is a king from a queen bed
7559,100 latex mattress australia
7560,why hip pain at night
7561,how much larger is a king mattress than a queen
7562,average weight of queen mattress
7563,best mattress for bad circulation
7564,best futon frame
7565,tuft and needle adjustable base
7566,can you put a pillow in the washing machine
7567,twin bed frame mattress and box spring
7568,describe sleep paralysis
7569,drooling disorder
7570,width and length of a full size mattress
7571,how to wash large comforter
7572,how many feet is a king bed wide
7573,how often should you replace your box spring
7574,what's the length of a full size bed
7575,how to clean large comforter
7576,is full size bigger than twin
7577,what is the biggest comforter size
7578,why do i always sweat at night
7579,memory foam mattress chemical smell
7580,homebase underbed storage
7581,how long should memory foam mattress air out
7582,number of coils in a mattress
7583,best mattress for toddler full bed
7584,do i need to dry my pillow before using
7585,hot sleeper meaning
7586,what size washer will fit a king size comforter
7587,how many hours should i stay awake
7588,why we sweat when we sleep
7589,california king mattress storage bag
7590,latex memory foam mattress topper
7591,twin bed cooling pad
7592,latex foam or spring mattress
7593,why is memory foam called memory foam
7594,benefits of a consistent sleep schedule
7595,queen bed width inches
7596,california king sheets vs king sheets
7597,bed size for room size
7598,adjustable air mattress bed reviews
7599,king size adjustable base
7600,two twin beds make a king
7601,cashmere blanket queen size
7602,best full size pillow top mattress
7603,should i get a full or queen bed
7604,high queen size bed
7605,twin size comforter measurements
7606,memory foam mattress slatted bed frame
7607,what to put between mattress and bed frame
7608,2 inch pu foam mattress
7609,twin queen
7610,difference of queen and full bed
7611,california king bed vs full size
7612,california king bed vs full size
7613,vacuum mattress instructions
7614,is a soft mattress better for your back
7615,are queen and full sheets the same
7616,split top adjustable mattress
7617,how to store a mattress
7618,latex mattress edge support
7619,pillow top mattress back pain
7620,twin and full size bed
7621,afraid of sleep paralysis
7622,tulo mattress layers
7623,cal king or king size
7624,how to build a mattress foundation
7625,best bed cushion for back pain
7626,how to take out mattress stains
7627,best soft pillow top mattress
7628,memory foam mattress blog
7629,what's the measurements of a king size mattress
7630,how long do foam pillows last
7631,best beds of 2020
7632,cool comfort mattress pad
7633,difference between full and twin sheets
7634,what are the dimensions of bed mattresses
7635,best no sag mattress
7636,high end firm mattress
7637,coop home goods pillow smell
7638,firmness of mattress for side sleepers
7639,what is the size of an eastern king mattress
7640,how much wider is a king than a queen bed
7641,ll bean bedding comforters
7642,top heavy people
7643,california king bed for sale
7644,luxi mattress review
7645,gel foam hybrid mattress
7646,full mattress cost
7647,how long can a person sleep
7648,natural latex mattress online
7649,under mattress
7650,king size queen size twin size
7651,breathable duvet insert
7652,turning over memory foam mattress
7653,is there an alaskan king size bed
7654,different size mattress dimensions
7655,visco memory foam topper reviews
7656,best material for throw blanket
7657,how many calories are you supposed to burn a day
7658,i need a wake up call
7659,can you put pillows in the washing machine
7660,difference in twin and full
7661,sleep paralysis pain in side
7662,talalay latex foam mattress topper
7663,twin bed frame dimensions chart
7664,mattress under 100
7665,sleeping on my side causes hip pain
7666,where do bed bugs hide in mattresses
7667,the best quality mattress
7668,queen size mattress for heavy person
7669,memory foam mattress dimensions
7670,how can you burn calories
7671,amerisleep as2 reviews
7672,what is the largest mattress you can buy
7673,where to buy adjustable beds
7674,do you flip memory foam mattresses
7675,can you tumble dry feather pillows
7676,firm hospital bed mattress
7677,eco hybrid mattress
7678,king size bed mattress dimensions in cm
7679,queen size matress base
7680,memory foam topper sheets
7681,comfortable mattress for back pain
7682,mattress and adjustable base
7683,best mattress pad queen
7684,how to compress a comforter
7685,spring back mattress
7686,purple 3 mattress cal king
7687,10 full size mattress
7688,whats the size of a queen bed
7689,yourtopper mattress reviews
7690,sleep hyperhidrosis causes
7691,queen mattress sale cheap
7692,what are the measurements for queen size mattress
7693,how often to change memory foam mattress
7694,how to wash big pillows
7695,what is the standard full size mattress dimensions
7696,whats bigger a twin or a full
7697,how large is a twin xl mattress
7698,can bed bugs get through mattress protectors
7699,avocado mattress twin
7700,how to keep adjustable split king mattress together
7701,sheets for memory foam mattress topper
7702,twin vs full size sheets
7703,memory foam mattress back problems
7704,best bed for pressure points
7705,can thinking about sleep paralysis make it happen
7706,double sponge mattress
7707,motion comfort king adjustable bed
7708,why did i sweat all night
7709,is queen size and full the same
7710,can you diffuse vanilla extract
7711,how big is a double bed inches
7712,soft like down mattress topper
7713,best bed cooling system
7714,king sized mattress dimensions
7715,who burned the most calories
7716,how to bleach white comforter
7717,best breathable summer blanket
7718,difference between talalay and dunlop
7719,sleeping organic mattress reviews
7720,how to reset sleep schedule
7721,what is the difference between full and full xl mattress
7722,rubber bed stoppers
7723,what's a good mattress for back pain
7724,do you need a box spring if you have slats
7725,how long can people go without sleep
7726,sleep ez latex
7727,full size compared to king
7728,california twin bed size
7729,bed that adjusts when you move
7730,what are the dimensions of a queen comforter
7731,diy vacuum packing
7732,how large is a queen bed
7733,standard bed frame dimensions
7734,memory foam mattress topper for side sleepers
7735,full size futon mattress size
7736,cheap new queen size mattress
7737,how big is a twin size bed in feet
7738,good sleep schedule
7739,what's the difference between queen and full
7740,what's the difference between queen and full
7741,california king mattress length
7742,california king mattress length
7743,do foam mattresses sag
7744,mattress one bed frames
7745,best firm neck support pillow
7746,king size bed area
7747,how to clean your bed from bed bugs
7748,will a king sheet fit a cal king
7749,slide out bed frame
7750,bed and mattress in a box
7751,best type of memory foam topper
7752,couples com reviews
7753,is an adjustable bed worth it
7754,how to get odor out of memory foam mattress
7755,zinus mattress for side sleepers
7756,average king mattress price
7757,viscosoft copper mattress topper
7758,how long can memory foam mattress stay compressed
7759,childrens mattresses
7760,how to memory foam mattress
7761,pillow for side sleepers with hip pain
7762,split king mattress sheets
7763,best hybrid king mattress under 1000
7764,type of bed for stomach sleepers
7765,best twin beds for adults
7766,does a mattress need a box spring
7767,sleep paralysis what does it feel like
7768,putting 2 twin beds together to make a king
7769,best memory brand
7770,great queen mattress
7771,full size vs queen size mattress
7772,mattresses without flame retardant
7773,queen size single bed dimensions
7774,are tempurpedic pillows machine washable
7775,how much is a full size mattress
7776,is a king box spring 2 twins
7777,snoring on stomach
7778,craftmatic adjustable bed reviews
7779,how many calories to burn a day
7780,how often should i replace my mattress
7781,queen and full size
7782,level sleep mattress topper
7783,my green mattress pure echo mattress
7784,how to keep cool during the night
7785,best mattress for paralyzed person
7786,queen size foam dimension
7787,how big is a cal king mattress
7788,foldable king size mattress
7789,choosing pillows for bed
7790,japanese cotton futon
7791,how many calories does a 50 year old male need
7792,3 fold futon mattress
7793,king size electric bed
7794,how to sleep to avoid sleep paralysis
7795,what type of mattress is best for lower back problems
7796,what is the difference between twin and twin xl bedding
7797,queen size futon and mattress
7798,what is the average width of a king size mattress
7799,length and width of twin bed
7800,what is the meaning of california king bed
7801,size of double vs queen bed
7802,memory foam mattress topper pregnancy
7803,world record no sleep
7804,twin to king bed strap
7805,what is smaller than a twin mattress
7806,best type of mattress for lower back pain
7807,eco pur mattress
7808,best pillow top mattress pad reviews
7809,best mattress topper for neck and back pain
7810,bed size dimensions chart
7811,what size mattresses are there
7812,cheap nice mattresses
7813,plant based memory foam mattress
7814,twin bed and double bed difference
7815,whats the difference between california king and king bed
7816,cooling memory foam bed
7817,king size innerspring mattress
7818,how to clean latex pillow
7819,what is the best mattress for an overweight person
7820,firmest mattress on the market
7821,king size mattress soft to medium
7822,do mattresses have a top and bottom
7823,what the size difference between a twin and full bed
7824,stains on pillow after sleeping
7825,nectar mattress packaging
7826,average cost of new queen mattress
7827,mattress memory foam mattress
7828,snuggle pedic vs coop
7829,twin avocado mattress
7830,poly sleep mattress review
7831,best position to lay for sciatica pain
7832,what is considered high density foam
7833,is a soft or firm bed better
7834,gel tech hybrid mattress
7835,is a very firm mattress good for you
7836,how many calories does 200 steps burn
7837,are bed bugs visible on mattress
7838,who sells futon mattresses
7839,bed frame for electric bed
7840,cool gel mattress topper queen
7841,best online mattress company
7842,what causes salivation during sleep
7843,adjustable bed buy
7844,european king vs california king
7845,cooling mattress pad with fitted skirt
7846,are foam mattresses good for side sleepers
7847,sustainable mattress companies
7848,best twin mattress under $500
7849,all natural latex mattress
7850,what is the difference between a california king
7851,sleeping on hard surface good for you
7852,what's the dimensions of a queen mattress
7853,oceano mattress
7854,latex mattress topper king
7855,purple power base not working
7856,what type of pillow is best for sleeping
7857,how to sleep better with scoliosis
7858,what size sheets fit a full xl bed
7859,cool gel memory foam mattress
7860,bedding for split king adjustable bed
7861,queen bed centimeters
7862,breathable memory foam mattress topper
7863,mattress differences
7864,how many calories do you burn a day naturally
7865,wake up people
7866,soaked mattress
7867,mattress for back problems
7868,box for bed
7869,what is size difference between queen and full
7870,dryer balls to fluff pillows
7871,best mattress topper under 100
7872,non toxic beds reviews
7873,why does my face sweat at night
7874,how to get back to a sleep schedule
7875,bed frame for split king adjustable bed
7876,best foam matress topper
7877,difference between futon and mattress
7878,active bed cooling
7879,best pillows for neck support side sleeper
7880,what causes drooling in your sleep
7881,difference between double bed and queen bed
7882,certified organic latex
7883,how long are xl twin mattresses
7884,best full foam mattress
7885,king koil futon mattress reviews
7886,keetsa return policy
7887,waking up with a sweaty pillow
7888,down vs gel mattress topper
7889,what is the most comfortable bedding set
7890,size difference queen and full
7891,best mattress protector for hot sleepers
7892,top rated bed blankets
7893,resty side sleeper pillow reviews
7894,top most comfortable mattresses
7895,california king size cotton blankets
7896,5 diamond blankets
7897,recover mattress
7898,affordable memory foam mattress topper
7899,best mattress for pressure point pain
7900,adjustable bed base king
7901,water cooled mattress
7902,difference in full and queen bed
7903,twin xl sheets on a twin bed
7904,are firm mattresses better
7905,zero gravity on adjustable bed
7906,toddler memory foam topper
7907,pillow buying guide
7908,difference between a full and queen
7909,is there a mattress between queen and king
