,Keyword
0,california king bed
1,california king vs king
2,adjustable beds
3,cal king vs king
4,queen mattress
5,california king bed size
6,queen size mattress
7,futon mattress
8,latex mattress
9,best mattress in a box
10,sleep calculator
11,best mattress for adjustable bed
12,mattress lifespan
13,how many calories do you burn sleeping
14,california king mattress size
15,how long does a mattress last
16,how long is a mattress good for
17,california king size
18,best adjustable beds
19,cal king size
20,how to keep mattress from sliding
21,memory foam vs spring
22,king vs california king vs queen
23,adjustable beds reviews
24,best bed in a box
25,difference between king and california king
26,best pillow
27,cal king bed
28,calories burned sleeping
29,cooling mattress pad
30,bed in a box
31,california king bed vs king
32,how many calories do you burn while sleeping
33,california king vs queen
34,bed size comparison
35,cal king bed size
36,split king mattress
37,pillow top
38,best king size mattress
39,best hybrid mattress
40,best foam mattress
41,are memory foam mattresses hot
42,best mattress for adjustable base
43,full size bed dimensions
44,best mattress for kids
45,how many calories does sleeping burn
46,mattress sizes
47,best pillow for sleeping
48,keep mattress from sliding
49,memory foam mattress for adjustable bed
50,mattresses for adjustable beds reviews
51,how long mattress last
52,how to stop mattress from sliding
53,king vs california king size
54,how to clean a memory foam mattress
55,best memory foam pillow
56,how long should a mattress last
57,mattress vacuum bag
58,california king bed dimensions
59,what is a hybrid mattress
60,adjustable bed mattress
61,do you burn calories when you sleep
62,can you wash memory foam pillows
63,how to wash memory foam pillow
64,california king
65,best memory foam mattress
66,coil vs foam mattress
67,split king
68,what is a split king bed
69,does sleeping burn calories
70,how many calories burned sleeping
71,california king mattress
72,mattress bed bugs
73,best queen mattress
74,how to get rid of bed bugs in a mattress
75,queen matress
76,can memory foam be washed
77,stop mattress from sliding
78,best split king mattress
79,foam vs spring mattress
80,why do i drool when i sleep
81,best futon mattress
82,best twin mattress for kids
83,how many calories do you burn when you sleep
84,how many calories do you burn in your sleep
85,vacuum seal mattress bag
86,futon matress
87,whats the difference between king and california king
88,best budget mattress
89,cooling mattress topper
90,best hybrid mattress for side sleepers
91,best bed for snoring
92,calories burned while sleeping
93,king vs cal king vs queen
94,are foam mattresses hot
95,is memory foam hot
96,wash memory foam pillow
97,how to clean memory foam pillow
98,cal king vs queen
99,organic latex mattress
100,best latex mattress
101,single mattress size
102,memory foam mattress reviews
103,adjustable bed frame reviews
104,california king dimensions
105,best mattress for side sleepers
106,should you flip your mattress
107,washing foam pillows
108,can a mattress last 20 years
109,clean memory foam pillow
110,difference in king and california king
111,how to keep bed from sliding
112,is memory foam toxic
113,california king bed vs queen
114,can you wash memory foam
115,best mattress for athletes
116,do you burn calories in your sleep
117,do you burn calories while sleeping
118,best california king mattress
119,california king bed measurements
120,twin bed dimensions
121,full size bed dimensions in feet
122,best cheap mattress
123,full size futon mattress
124,cal king bed dimensions
125,cal king bed dimensions
126,how to fix sleep schedule
127,cal king mattress size
128,spring mattress
129,california king mattress dimensions
130,cal king vs king size
131,difference between king and cal king
132,twin vs full
133,mattress reviews
134,best adjustable bed frame
135,california king vs queen size
136,how to keep your mattress from sliding
137,safest memory foam mattress
138,how to stop mattress from sliding off metal frame
139,king size bed dimensions
140,cal king vs king bed
141,best adjustable mattress
142,king v california king
143,hybrid memory foam mattress
144,how to clean foam mattress
145,memory foam vs spring mattress
146,how many calories burned while sleeping
147,best mattress for hip pain
148,what is a split king
149,split king adjustable bed
150,bed size chart
151,best cooling mattress pad
152,california king bed size in feet
153,cal king dimensions
154,best mattress for stomach sleepers
155,best mattress for scoliosis
156,is a california king bigger than a king
157,how to wash pillows
158,split king adjustable bed reviews
159,twin xl vs queen
160,king and california king
161,cleaning memory foam mattress
162,best firm mattress for adjustable bed
163,how often should you flip your bed
164,what is the difference between memory foam and spring mattress
165,how to stop mattress from sliding off bed frame
166,what is best mattress for adjustable bed
167,how to prevent mattress from slipping
168,how to stop mattress from sliding off box spring
169,how long does a mattress typically last
170,is memory foam mattress better than spring
171,which is better memory foam or coil mattress
172,how to wash foam pillows
173,best gel memory foam mattress
174,mattress for athletes
175,how to move a memory foam mattress
176,best mattress for snoring
177,how often should you flip your mattress
178,how often should you rotate your mattress
179,twin vs queen
180,can memory foam pillows be washed
181,how many calories do you lose when you sleep
182,what is a split king mattress
183,king vs california king dimensions
184,adjustable mattress
185,full bed dimensions
186,full size mattress dimensions
187,best queen size mattress
188,how much bigger is a king than a queen
189,latex bed
190,flip mattress
191,cooling pad for bed
192,eastern king vs cal king
193,california king vs eastern king
194,king versus california king
195,best affordable mattress
196,full size bed measurements
197,hybrid mattress vs memory foam
198,memory foam vs hybrid
199,split king vs king
200,why do people drool
201,what is a california king bed
202,california king vs regular king
203,best bed in a box mattress
204,do you burn calories sleeping
205,best split king adjustable bed
206,best mattress for back pain
207,do you lose calories when you sleep
208,calories burned during sleep
209,king vs cal king dimensions
210,memory foam versus coil mattresses
211,beds that elevate head and feet
212,memory foam mattress herniated disc
213,stains out of memory foam mattress
214,mattress how long do they last
215,memory foam mattress or spring coil
216,how to stop memory foam mattress from sliding
217,memory foam mattress vs traditional mattress
218,mattress keeps moving
219,is sleeping on memory foam safe
220,how long does the average mattress last
221,best mattress and adjustable base
222,can you wash pillows
223,how to keep my memory foam mattress from sliding
224,kids mattress
225,memory foam mattress for adjustable base
226,is spring mattress better than memory foam
227,split king vs king adjustable bed
228,keep mattress from sliding off box spring
229,why should you flip your mattress
230,how to keep bed from sliding on frame
231,do foam mattresses last longer than spring
232,mattress size comparison
233,what is better a foam mattress or spring
234,beds that you can raise the head
235,what is the difference between king and california king
236,king size bed vs california king
237,latex mattress reviews
238,what size is a california king bed
239,king vs queen bed
240,best mattress for back and hip pain
241,twin size bed dimensions
242,how big is a full size bed
243,how long can you go without sleep before hallucinating
244,memory foam mattress vacuum bag
245,king bed dimensions
246,how often to rotate mattress
247,how to keep mattress from sliding on adjustable bed
248,are memory foam mattresses safe
249,cal king mattress
250,memory foam mattress
251,how many calories do i burn while sleeping
252,how to wash memory foam
253,memory foam or spring mattress
254,foam or spring mattress
255,mattress for hip pain
256,can you wash foam pillows
257,full vs queen
258,full vs queen
259,size difference between queen and california king
260,width of california king bed
261,how many calories do u burn sleeping
262,twin xl mattress for adjustable bed
263,kids full size mattress
264,how big is a california king size bed
265,queen size mattress dimensions
266,queen size bed dimensions cm
267,why do i drool in my sleep
268,best bed for side sleepers
269,queen size bed dimensions in feet
270,best king size bed
271,memory foam vs gel memory foam
272,best cooling mattress topper
273,mattress in a box reviews
274,king and california king size
275,full futon mattress
276,why do people drool when they sleep
277,hybrid vs foam mattress
278,stop mattress sliding on metal frame
279,how to stop your mattress from moving
280,what is better memory foam or spring mattress
281,prevent mattress from sliding
282,which mattress is best spring or foam
283,which mattress is better memory foam or spring
284,can you put memory foam pillows in the washer
285,memory foam core pillow review
286,is a memory foam mattress better than a spring mattress
287,best twin xl mattress for adjustable base
288,next memory foam mattress reviews
289,how to keep mattress from sliding on frame
290,mattress moves off box spring
291,gel memory foam toxic
292,foam versus coil mattress
293,do you burn calories while you sleep
294,are hybrid mattresses good for side sleepers
295,stop mattress from slipping
296,mattress hybrid vs memory foam
297,how to stay cool on a memory foam mattress
298,moving a memory foam mattress
299,mattress dimensions
300,is polyurethane foam toxic
301,best cal king mattress
302,how many calories do you lose sleeping
303,difference between california king and queen
304,what is the best memory foam mattress
305,how much calories do you burn sleeping
306,how many calories do we burn sleeping
307,split king mattress reviews
308,how many calories burned during sleep
309,how to keep mattress from sliding on metal bed frame
310,dunlop latex mattress
311,how often to flip mattress
312,how many calories do you burn while you sleep
313,best gel mattress
314,are foam mattresses safe
315,queen vs california king dimensions
316,cooling mattress topper queen
317,how long can you go without sleep
318,how to clean foam pillows
319,king size mattress dimensions
320,bed dimensions
321,drooling while sleeping
322,best twin mattress for toddler
323,cooling gel mattress pad
324,how to clean memory foam
325,how to clean memory foam
326,what is a california king bed
327,labor day mattress sales
328,what are the dimensions of a full size bed
329,eastern king vs king
330,how big is a california king
331,why do people drool in their sleep
332,bed in a box reviews
333,bed sizes in feet
334,california king bed vs king bed
335,best cooling mattress pad for hot flashes
336,best adjustable bed base
337,split king mattress size
338,roll up memory foam mattress
339,best foam pillow
340,best mattress for children
341,innerspring mattress for adjustable bed
342,is memory foam bad for you
343,vacuum seal mattress storage bags
344,best mattress for an adjustable bed frame
345,how to keep box spring from slipping off frame
346,foam mattress vacuum bag
347,can you fold a memory foam mattress
348,do you burn more calories when you sleep
349,memory foam mattress with coil springs
350,twin xl bed
351,best latex mattress for adjustable bed
352,how to keep mattress from sliding on box spring
353,mattress slides on metal frame
354,memory foam pillow
355,how to stop bed from sliding on box spring
356,memory foam vs latex vs spring
357,king or split king
358,can you put memory foam in the washing machine
359,can you put memory foam pillows in the dryer
360,cooling mattress
361,do foam mattress toppers make you hot
362,pillow top mattress
363,best mattress topper
364,california king sized bed
365,best beds
366,what mattress for child
367,best comforters
368,are memory foam mattresses toxic
369,is spring mattress better than foam
370,hybrid mattress with adjustable base
371,what are the dimensions of a california king mattress
372,cleaning foam mattress
373,best mattress for bulging disk
374,sleeping calories
375,memory foam mattress vs traditional spring mattress
376,best adjustable bed base king
377,beds that raise head and foot
378,how many calories do you burn sleeping 8 hours
379,cal king size vs queen
380,queen mattress dimensions
381,keep a mattress from slipping
382,memory foam health risks
383,how to keep box spring from sliding
384,how often should i flip my mattress
385,best split king adjustable base
386,queen size bed mattress
387,drooling at night
388,rotate mattress
389,king mattress vs california king
390,how much bigger is a king bed than a queen
391,what are the dimensions of a california king bed
392,king or california king
393,pillow top memory foam mattress
394,queen vs king
395,king size bed vs queen
396,memory foam pillow top
397,sleep cycle calculator
398,compressed mattress
399,pillow top vs memory foam
400,can sleep paralysis kill you
401,how to fix your sleep schedule
402,best mattress for herniated disc
403,36 hours without sleep
404,high quality mattress
405,foam mattress reviews
406,roll up mattress
407,twin xl vs full
408,soft mattress
409,california king bed measurements
410,best mattress for combination sleepers
411,best futon
412,california king size beds
413,why do i drool so much when i sleep
414,adjustable twin mattress
415,mattress chart
416,cooling matress topper
417,cooling mattress topper king
418,best organic latex mattress
419,whats the difference between a king and california king
420,queen size mattress cost
421,average life of a mattress
422,king size bed vs cal king
423,how long is a mattress
424,king vs full bed
425,whats a split king
426,mattress storage bag vacuum
427,vacuum pack mattress bag
428,best adjustable base
429,kids memory foam mattress
430,how to store a memory foam mattress
431,mattress size chart
432,washing memory foam pillow in washing machine
433,sleep time calculator
434,how to keep mattress from sliding on slats
435,foam or spring mattress for bad back
436,best power base for bed
437,how to move a foam mattress
438,how many calories you burn sleeping
439,how big is a california king bed
440,king vs queen bed
441,mattress sliding
442,how to roll up a memory foam mattress
443,full vs queen size
444,how much bigger is a king than a full
445,foam density
446,beds that raise your head
447,memory foam core pillows reviews
448,how much calories do you burn when you sleep
449,king mattress dimensions
450,mattress for snoring
451,mattress keeps sliding away from headboard
452,spring or foam mattress for back pain
453,can you put memory foam in washer
454,how to roll up foam mattress
455,best mattress for adjustable split king
456,twin xl dimensions
457,mattress keeps sliding off bed
458,futon mattress sizes
459,memory foam mattress or regular
460,split king size
461,memory foam mattress vs memory foam spring mattress
462,can you dry a memory foam pillow
463,how to pack a memory foam mattress
464,mattress for slip disc
465,how long is a mattress good
466,can you vacuum seal a memory foam mattress
467,washing memory foam
468,memory foam risks
469,beds that help with snoring
470,does a memory foam mattress make you hot
471,best mattress for an adjustable base
472,can you burn calories by sleeping
473,how to cool a memory foam bed
474,gel foam vs memory foam
475,how to stop mattress from moving
476,beds that raise head and feet
477,do u burn calories when u sleep
478,stop mattress from sliding on box spring
479,how to cool memory foam mattress
480,best online mattress
481,cal king versus king
482,best gel foam mattress
483,how many calories do you lose while sleeping
484,latex vs memory foam vs spring
485,how to wash foam pillows in the washing machine
486,difference in king and cal king
487,budget mattress
488,firm mattress for adjustable bed
489,how to get mattress to stay in place
490,best cooling mattress
491,queen vs king size
492,king vs california king measurements
493,king vs california
494,cooling mattress cover
495,what is the best adjustable bed
496,california bed size
497,full size mattress
498,why do you drool when you sleep
499,good quality mattress
500,latex mattress reviews
501,king mattress vs cal king
502,cooling mattress pad twin xl
503,how to compress a memory foam mattress
504,king mattress size
505,adjustable bed mattress only
506,adjustable bed frame
507,best firm mattress
508,mattress for scoliosis
509,what is an eastern king size bed
510,memory foam futon mattress
511,king size mattress vacuum bag
512,memory foam vs coil mattress
513,whats bigger king or california king
514,twin mattress dimensions
515,how often should i rotate my mattress
516,how much bigger is a california king than a king
517,what is a comforter
518,twin vs twin xl
519,best adjustable beds for snoring
520,what does it mean when you drool in your sleep
521,high density foam
522,how often rotate mattress
523,memory foam hot sleeper
524,cal king bed measurements
525,eco friendly mattress
526,memory foam mattress comparison
527,why do i drool at night
528,cooling memory foam mattress topper
529,size difference between queen and california king bed
530,how long can you stay awake
531,how wide is a california king bed
532,split king what is
533,how much calories do you burn in sleep
534,polyurethane foam mattress health risks
535,size difference between queen and california king mattress
536,memory foam mattress health hazards
537,best full size mattress
538,whats a hybrid mattress
539,twin vs queen
540,do i burn calories while sleeping
541,can you vacuum seal a mattress
542,comfortable futon mattress
543,do you burn more calories when sleeping
544,what kind of mattress for an adjustable bed
545,vacuum seal bag for foam mattress
546,queen vs california king bed
547,queen vs california king size
548,best mattress
549,can u wash a memory foam pillow
550,memory foam toxic symptoms
551,hybrid foam mattress
552,how to make memory foam mattress cooler
553,king v cal king
554,cooling gel mattress topper
555,best mattress for side sleepers with hip pain
556,full mattress dimensions
557,stop bed from sliding
558,hybrid mattress
559,memory foam mattress sagging
560,best rated adjustable beds
561,california king bed size comparison
562,queen bed vs king bed vs california king
563,how wide is a california king
564,bigger than california king
565,how often should you flip a mattress
566,best mattress for ruptured disc
567,are memory foam mattress toppers safe
568,hybrid mattress for adjustable bed
569,how to fold a memory foam mattress
570,how do you cool down a memory foam mattress
571,california king mattress reviews
572,how many calories do you burn while sleeping 8 hours
573,vacuum sealed mattress
574,hybrid or foam mattress
575,can you wash a tempurpedic pillow
576,what are the dimensions of a california king
577,why do i sweat in my sleep
578,foam mattress toxic chemicals
579,how many kilojoules do you burn sleeping
580,which is bigger king or california king
581,is gel memory foam safe
582,best mattress for teenager
583,best memory foam bed
584,best foam mattress for adjustable bed
585,what size is a cal king mattress
586,twin mattress for toddler
587,are foam mattresses better than spring mattresses
588,vacuum bag for mattress compression
589,the best adjustable bed and mattress
590,are twin xl and queen the same
591,what mattress can be used on an adjustable bed
592,best bed to stop snoring
593,how to flip a mattress
594,healthy memory foam mattress
595,how often should you turn your mattress
596,cal king size bed dimensions
597,best mattress to stop snoring
598,california king measurements
599,how long does a matress last
600,memory foam or spring
601,difference between memory foam and gel memory foam
602,best queen bed
603,extra firm mattress for adjustable bed
604,best twin xl mattress for adjustable bed
605,how to keep cool on a memory foam mattress
606,gel memory foam mattress
607,best mattress for reclining bed
608,best bed power base
609,is twin xl same as queen
610,what is better foam or spring mattress
611,best bed for athletes
612,does foam mattress get hot
613,california king compared to queen
614,are memory foam beds hot
615,rolled foam mattress
616,most comfortable futon mattress
617,best queen mattress for adjustable bed
618,twin xl size
619,how long can a person go without sleep
620,hybrid vs memory foam bed
621,best king mattress
622,how many calories are lost while sleeping
623,memory foam adjustable bed
624,king size mattress
625,king vs full
626,are coil mattresses better than foam
627,split king bed
628,why do i drool
629,regular mattress
630,sports mattress
631,how to store a mattress topper
632,queen vs twin
633,queen vs twin
634,how many calories do i burn in my sleep
635,california king compared to king
636,roll up foam mattress
637,how long do good mattresses last
638,are memory foam mattresses better than spring
639,best bed in box
640,should you rotate your mattress
641,are foam mattress toppers hot
642,best gel bed mattress
643,how to get bed bugs out of mattress
644,how long should you have a mattress
645,sleeping calories burned per hour
646,king size bed vs queen
647,split king adjustable bed with mattress
648,mattress sizes in inches
649,memory foam or hybrid
650,hybrid mattress reviews
651,hybrid mattress vs gel memory foam
652,how many calories i burn while sleeping
653,why can t i sleep
654,what is a california king
655,what is a california king
656,memory foam fire retardant
657,latex vs gel memory foam mattress
658,split king vs king size bed
659,when should i wake up
660,best natural latex mattress
661,keep bed from sliding
662,best soft mattress
663,how to dry memory foam pillow
664,best mattress for split king
665,why do i slobber when i sleep
666,how to cool down a memory foam mattress
667,eastern king bed vs california king
668,are foam mattresses good
669,vacuum seal bags for king size mattress
670,king vs cal king measurements
671,is a foam or spring mattress better
672,memory foam pillow review
673,cheap futon mattress
674,california king size bed size
675,reviews of split king adjustable beds
676,how to stop bed from sliding
677,rem sleep calculator
678,adjustable bed frame king
679,the best adjustable beds
680,twin xl mattress size
681,best mattress for electric adjustable bed
682,how to put memory foam mattress back in box
683,king size vs california king size
684,difference between twin and twin xl
685,hybrid mattress vs foam
686,king size cooling mattress topper
687,twin size bed
688,full vs king
689,california king bed vs king size bed
690,foam mattress comparison
691,gel vs memory foam
692,twin xl bed frame dimensions
693,best cooling mattress cover
694,do you burn more calories awake or asleep
695,mattress for herniated disc
696,kids twin mattress
697,best adjustable beds and mattresses
698,what is foam mattress
699,what is the best king size mattress
700,spring foam mattress
701,how long to keep a mattress
702,memory foam spring mattress
703,futon reviews
704,split king dimensions
705,adjustable bed base reviews
706,how many calories do you burn sleeping calculator
707,what is a pillow top mattress
708,best full size mattress for kids
709,what is the best foam mattress
710,how wide is a california king bed
711,mattress sizes in cm
712,mattress causing hip pain
713,queen vs twin xl
714,different mattress sizes
715,pillow top mattress vs memory foam
716,what is the difference in king and california king
717,sponge pillow
718,memory foam mattress too hot
719,top rated adjustable beds
720,whats a california king
721,best bed for hip pain
722,best type of mattress for kids
723,all latex mattress
724,best rated mattress in a box
725,36 hours no sleep
726,child mattress
727,beds for athletes
728,how to vacuum seal a mattress
729,how big is a cal king bed
730,can you flip a memory foam mattress
731,best affordable queen mattress
732,king vs california king sheets
733,queen mattress vacuum bag
734,drooling when you sleep
735,standard mattress sizes
736,mattress in a box
737,best adjustable king size bed
738,best medium firm mattress
739,what is the best mattress in a box
740,coolest bed in a box
741,how wide is a cal king bed
742,how wide is a cal king bed
743,mattress topper that keeps you cool
744,how big is a california king size bed
745,what size is a cal king bed
746,california king size bed dimensions
747,bed bug eggs on mattress
748,queen bed vs king bed
749,are hybrid mattresses good
750,single mattress dimensions
751,best mattress topper for hot sleepers
752,memory foam density
753,why do we drool when we sleep
754,king size mattress reviews
755,best full size mattress for toddler
756,mattress bag
757,drooling while sleeping causes
758,water cooled mattress pad
759,combination foam mattress
760,cooling topper
761,split king vs california king
762,split king vs king sheets
763,twin vs twin xl vs queen
764,top adjustable beds
765,california king bed mattress size
766,floyd bed mattress sliding
767,what's a hybrid mattress
768,are gel mattress toppers toxic
769,queen size vs cal king size
770,what's better spring or foam mattress
771,good king size mattress
772,mattress is hot to sleep on
773,best queen size bed
774,best cooling gel mattress topper
775,innerspring futon mattress
776,best pillows 2020
777,queen vs king size
778,split king adjustable bed frame reviews
779,mattress topper too hot
780,early morning wake up call
781,vacuum packed mattress
782,how many days can u go without sleep
783,are foam beds safe
784,cal king measurements
785,can you reroll a bed in a box
786,gel vs latex mattress
787,how many calories do you burn at night sleeping
