,Keyword
4340,year round blanket
4341,100 organic latex mattress
4342,essential oils for feeling run down
4343,washing pillows in washer
4344,should i get a king or california king bed
4345,tulo mattress off gassing
4346,coop home goods pillow washing instructions
4347,difference in dimensions between queen and king bed
4348,best japanese futon bed
4349,soft mattress back pain
4350,do mattresses come with box spring
4351,do you need to flip a tempurpedic mattress
4352,standard us king size bed dimensions
4353,better pillow better sleep
4354,a good mattress
4355,do beds have to have a box spring
4356,difference between twin and full bed
4357,sky zone all nighter
4358,what bed is bigger king or queen
4359,bed bugs on the mattress
4360,how to prevent back pain when sleeping
4361,top rated mattresses for stomach sleepers
4362,hypoallergenic blankets allergy
4363,mattress without springs
4364,latex mattress hot sleeper
4365,headboards for adjustable base beds
4366,twin sheet dimensions
4367,new mattress causing back pain
4368,what is a good mattress for sciatica
4369,best type of bed for side sleepers
4370,lifespan of memory foam mattress topper
4371,what's the best hybrid mattress
4372,mattress you can roll up
4373,parachute down mattress topper
4374,cooling mattress cover reviews
4375,mattresses that don t sink
4376,the most comfortable pillow
4377,will a mattress topper fix a sagging mattress
4378,top bed mattress brands
4379,performasleep reviews
4380,separate comforters for king bed
4381,healthy foundations memory foam
4382,where to buy mattress bags for moving
4383,twin and queen bed
4384,best mattress 2019 reviews
4385,how do bed bugs get in your bed
4386,what is the best online mattress company
4387,best pillow for side and belly sleepers
4388,what is the best queen mattress for under 1000
4389,memory foam too firm
4390,top 10 king size mattress
4391,hip alignment pillow
4392,bed frame for queen adjustable bed
4393,mechanical adjustable bed
4394,split king electric bed
4395,adjustable bed base and mattress set
4396,top rated twin mattress
4397,full size futon matress
4398,how to have the best night sleep
4399,old mattress causing back pain
4400,what is the world record for staying awake
4401,what to look for when buying a mattress topper
4402,rolled up bed in a box
4403,how did people wake up before alarm clocks
4404,you sleep pillows
4405,52 x 72 bed size
4406,how to speed up mattress off gassing
4407,showering at night vs in the morning
4408,why do people sleep
4409,memory foam mattress meaning
4410,do firm mattresses cause back pain
4411,how to clean your mattress stains
4412,whats the difference between full and queen mattress
4413,latex cooling mattress topper
4414,how many active calories should i burn a day
4415,double queen size bed difference
4416,nacreous mattress pad from slumber cloud
4417,what does it mean if you sweat in your sleep
4418,is a full and twin bed the same
4419,treatment for bed bugs on mattress
4420,difference in a queen and king bed
4421,difference in a queen and king bed
4422,what r the dimensions of a king size bed
4423,good twin mattress
4424,how long should a pillow top mattress last
4425,most firm mattress available
4426,do i need box springs with a memory foam mattress
4427,good foam
4428,top inexpensive mattresses
4429,latex memory foam combination mattress
4430,bed frame that doesn t move
4431,is full xl the same as queen
4432,compare bed in a box mattresses
4433,body impressions mattress topper
4434,what are the dimensions of a california king
4435,sleep train adjustable beds
4436,roll up mattress pad
4437,two twin beds make a queen
4438,two twin beds make a queen
4439,nolah vs layla
4440,queen size massage mattress
4441,latex mattress topper king size
4442,what is difference between full and queen
4443,deep hip pain while sleeping
4444,how many calories does a female burn per day
4445,what size is a king size bed in inches
4446,xl king size bed
4447,mattress topper to make softer
4448,6 inch futon mattress cover
4449,best pocket spring mattress 2019
4450,is a king bed longer than a queen
4451,best pillow manufacturer
4452,queen adjustable bed base only
4453,toddler bed vs twin bed size difference
4454,king size mattress with adjustable base
4455,bed in box mattress
4456,same day mattress
4457,are twin and full beds the same length
4458,how to get stains off mattress
4459,memory foam mattress smells of sweat
4460,bed in a box for side sleepers
4461,dimensions of queen size bed cm
4462,diff between king and california king
4463,environmentally friendly memory foam mattress
4464,how to move a queen size mattress by yourself
4465,spring gel
4466,is a firm mattress better for sciatica
4467,is a king mattress longer than a queen
4468,crib mattress size compared to twin
4469,why do i sometimes sweat at night
4470,top rated beds for back pain
4471,will a comforter fit in a washing machine
4472,twin latex foam mattress
4473,best rated extra firm mattress
4474,will california king sheets fit a standard king bed
4475,best blankets for winter in india
4476,twin and full size bed dimensions
4477,do they make a split queen adjustable bed
4478,ecosa memory foam pillow review
4479,how much bigger is an alaskan king bed
4480,layla sleep pillow review
4481,innerspring foam mattress
4482,queen size and king size mattress dimensions
4483,rest master mattress reviews
4484,bestfirm
4485,2 inch vs 3 inch topper
4486,is a twin bed half the size of a queen
4487,the world record for not sleeping
4488,best bed mattress for back pain
4489,hybrid mattress on slats
4490,thick comforters bed in a bag
4491,does an adjustable bed need a special mattress
4492,how to tell if memory foam mattress is worn out
4493,tall futon
4494,osteoporosis mattress toppers
4495,best mattress for posture
4496,natural form mattress complaints
4497,how to get rid of bed bugs in your bed
4498,what does sleep paralysis feel like
4499,how often to change your mattress
4500,difference between full size bed and queen size bed
4501,best high end pillows
4502,is it bad to have your bed on the floor
4503,full size measurements vs queen
4504,adjustable bed foundation
4505,bed sizes alaskan king
4506,weight limit on purple mattress
4507,cool gel mattress cover
4508,difference between double and king
4509,plastic mattress protector for storage
4510,synthetic latex mattress off gassing
4511,amerisleep as3 mattress review
4512,california king bed comforter dimensions
4513,how long should a mattress last before sagging
4514,red nomad 10 inch memory foam mattress
4515,mattress cooler classic
4516,4 inch firm memory foam mattress topper
4517,slobber when i sleep
4518,queen memory foam futon
4519,can you get ptsd from sleep paralysis
4520,best hospital mattress
4521,how to wash pillows in a washing machine
4522,best mattress and box spring covers for bed bugs
4523,eastern cal king
4524,live and sleep reviews
4525,what is bigger california king or king
4526,belly face down on the mattress
4527,amerisleep mattress dubai
4528,y do i sweat at night
4529,best pillow for all position sleepers
4530,what's the difference between a cal king and a king
4531,full size bed mattress dimensions
4532,the latex mattress company
4533,purple harmony pillow sale
4534,cedar natural luxe mattress review
4535,putting 2 twin xl beds together
4536,split top queen adjustable bed
4537,sleep cell sleeping bag with memory foam
4538,mattress that moves
4539,difference in size between california king and king
4540,what is a good affordable mattress
4541,good night mattress pads
4542,can you put a mattress on the floor
4543,what are the dimensions of an xl twin mattress
4544,how big a bedroom for a king size bed
4545,why do people sleep so much
4546,kathmandu blanket
4547,moving a full size mattress
4548,best toddler mattress
4549,what does split king mean
4550,how much bigger is a king bed from a queen
4551,6 inch pillow top mattress pad
4552,how to wake up someone on call
4553,can king sheets fit a queen bed
4554,best mattress customer reviews
4555,mattress people
4556,are organic mattresses worth it
4557,why is sleep paralysis so scary
4558,best mattress hours
4559,are lull mattresses good
4560,firm mattress better sleep
4561,cheap king size adjustable base
4562,how to soften memory foam mattress
4563,best rated pillow brands
4564,pillow top mattress or not
4565,california king memory foam bed frame
4566,topper organic plus
4567,top memory foam pillows 2018
4568,best bed mattress for side sleepers
4569,what is inside mattress
4570,blended talalay vs natural
4571,queen bed is how wide
4572,bed set for adjustable base
4573,zen bamboo mattress protector review
4574,where to get a futon
4575,what is the width of a double bed in cm
4576,how big a washer for queen size comforter
4577,bed in a box memory foam mattress reviews
4578,king queen double single size
4579,thin comfortable mattress
4580,average calories
4581,mattress too hard
4582,difference in size of twin and twin xl
4583,electric adjustable beds with memory foam mattress
4584,how heavy is a full mattress
4585,twin xl comforter size inches
4586,what is the width of a king mattress
4587,difference between twin and full mattress
4588,what size bed is two twins
4589,galaxy memory foam mattress reviews
4590,king bed measurements in feet
4591,shikibuton vs futon
4592,should my mattress be firm or soft
4593,best mattress protector for adjustable beds
4594,queen size hybrid mattress
4595,single vs double bed size
4596,can a too firm mattress cause sciatica
4597,how to get back into a sleep routine
4598,chilipad mattress topper king size reviews
4599,two twin beds equal a king
4600,two twin beds equal a king
4601,when does your body burn the most calories
4602,why do the king and queen sleep in separate beds
4603,can stomach sleepers have sleep apnea
4604,certipur us high density foams
4605,is memory foam mattress good for side sleepers
4606,mattress for side sleepers with lower back pain
4607,do two twins equal a king
4608,good mattress reviews
4609,best electric beds to buy
4610,zippable mattress cover
4611,pur cool gel pillow
4612,how many calories burn a day average person
4613,flip memory foam mattress
4614,best soft but firm mattress
4615,standard bed dimensions
4616,breathable pillow
4617,full size dimensions
4618,sleeping positions to stop snoring
4619,roll out foam mattress
4620,best mattress size
4621,does a full bed fit in a queen frame
4622,does spring mattress cause back pain
4623,bedtime calculator age
4624,can i put a headboard on an adjustable bed
4625,tips for side sleepers
4626,full xl latex mattress
4627,mattress sizes single vs twin
4628,musty smell memory foam mattress
4629,adjustable base bed foundation
4630,double california king bed
4631,luxi sleep mattress review
4632,5 memory foam mattress topper with down and feather layers
4633,best twin mattress for platform bed
4634,single comforter size
4635,best sleeping position for growth
4636,54 x 75
4637,are king beds square
4638,best memory foam pillow under 50
4639,best way to change your sleep schedule
4640,memory foam mattress on top of box spring
4641,pillows for headache sufferers
4642,twin size mattress vs queen
4643,washing bed pillows
4644,does king bedding fit cal king
4645,how to dry pillows
4646,low fill pillow
4647,twin and double bed difference
4648,alzheimer's sleeping too much
4649,best mattress for obese people
4650,is a 6 inch mattress thick enough
4651,mattress size scale
4652,how to not sweat during sleep
4653,side retainer bar for adjustable bed
4654,best mattress material for side sleepers
4655,does a hot or cold shower help you sleep
4656,firm mattress for side sleepers
4657,firm mattress for side sleepers
4658,low loft firm pillow
4659,waking up during the night soaked in sweat
4660,purple memorial day
4661,best pillow under 50
4662,does a mattress protector prevent bed bugs
4663,best king size mattress under 1000
4664,pottery barn cashmere throw
4665,best mattress on amazon under 500
4666,best blankets brand for winter in india
4667,will 2 single mattresses make a king
4668,best mattress for achy body
4669,memory foam chemical smell
4670,bed slat straps
4671,is jasmine essential oil good for sleep
4672,get rid of bed
4673,5 feet mattress
4674,what is the size of a full bed in feet
4675,how wide is a wueen bed
4676,is twin bed smaller than full
4677,vacuum seal mattress bag home depot
4678,best floor futon
4679,double bed queen bed comparison
4680,can you fit a full size mattress in an suv
4681,bed gel cooling pad
4682,how to break down mattress
4683,width of king bed frame
4684,box spring bottom material
4685,dunlop vs talalay durability
4686,double bed length vs queen
4687,california eastern king bed
4688,very soft mattress topper
4689,wide is a full size bed
4690,mattress that doesn t sag
4691,how to deodorize bed
4692,what's the difference between a california king and regular king
4693,are memory foam mattresses good for toddlers
4694,best gel memory foam topper
4695,is memory foam better than hybrid
4696,2020 mattress
4697,latex mattress topper reviews
4698,queen size mattress rolled up
4699,futon support bar
4700,king size duvet cover size chart
4701,100 natural talalay latex topper talalay global by plushbeds
4702,what causes a person to drool in their sleep
4703,what does staying awake for 24 hours do
4704,dimensions of a crib size mattress
4705,how to keep a split king adjustable bed together
4706,do you need a bed frame for box spring
4707,soft topper for bed
4708,what are the benefits of memory foam mattress
4709,what makes people wake up
4710,best mattress edge support
4711,how to prevent bed from rolling on hardwood floor
4712,are memory foam toppers good for your back
4713,twin size adjustable bed with mattress
4714,queen size mattress for sale cheap
4715,bed with two different firmness
4716,hybrid mattress with micro coils
4717,wide twin bed
4718,the measurements of a king size bed
4719,eco latex mattress
4720,king split base
4721,no sleep for 11 days
4722,how long can the body function without sleep
4723,average calories burned per day male
4724,best floor mattress
4725,the best mattress for overweight
4726,smarty bandzz
4727,mattress firmness comparison
4728,can a california king fit a king bed frame
4729,how to choose a mattress for sleep apnea
4730,how to stop memory foam from sliding
4731,38 inch wide twin mattress
4732,how wide is a standard twin bed
4733,comfiest mattress
4734,how many calories does a 110 pound woman need
4735,split king adjustable bed frame with massage
4736,bedroom size for queen bed
4737,king dimensions in inches
4738,stay cool memory foam mattress topper
4739,queen bed comforter dimensions
4740,bed frame back pain
4741,foam vs spring mattress for toddler
4742,can you use a futon frame for a regular mattress
4743,what is a good mattress brand
4744,how to not sweat at night
4745,do warm showers make you sleepy
4746,what are the dimensions of a twin xl mattress
4747,how to stop clenching jaw while sleeping
4748,queen size cooling pad
4749,best mattress manufacturer
4750,how many calories does my body burn
4751,how many calories do you burn daily
4752,whats the size difference between queen and full
4753,do two twin mattresses make a queen
4754,talalay latex mattress brands
4755,talalay latex mattress brands
4756,viscoelastic foam mattress
4757,viscoelastic foam mattress
4758,how often should i get a new mattress
4759,texas king bed vs california king
4760,texas king bed vs california king
4761,can you wash a comforter in a washing machine
4762,100 percent natural latex mattress
4763,how do i clean a mattress
4764,how much calories your body burns a day
4765,why do i burn up at night
4766,best mattress for lumbar back pain
4767,twin bed width cm
4768,difference california king and king size
4769,how much longer is twin xl than twin
4770,aloe gel mattress review
4771,best mattress cleaner
4772,queen vs king mattress dimensions
4773,best pillow for all sleep positions
4774,is a king size bed bigger than a queen size
4775,bedroom mattress reviews
4776,pillow top mattress good for back pain
4777,what is the length and width of a queen bed
4778,where to dispose mattress near me
4779,what's the dimensions of a king size bed
4780,do adjustable bed frames need special mattresses
4781,best memory foam mattress toppers ratings
4782,how many calories used
4783,hybrid bed in a box mattress
4784,www bedinabox com reviews
4785,how to get rid of bed bugs
4786,best king mattress for stomach sleepers
4787,ways to keep mattress topper from sliding
4788,single bed width
4789,perfect pressure mattress reviews
4790,twin xl mattress price
4791,memory foam top layer
4792,top hybrid mattresses 2020
4793,latex mattress australia mosman
4794,adjustable bed frame with massage
4795,the difference between california king and regular king
4796,how many calories does your body need
4797,alaskan king bed vs king
4798,how much does a futon cost
4799,twin size and full size difference
4800,how to choose a mattress for a toddler
4801,split top adjustable king bed
4802,foam based mattress
4803,two twin beds equal what size bed
4804,nature's sleep crystal mattress
4805,longest without sleep
4806,car mattress foam
4807,best soft mattress topper 2019
4808,sleep paralysis symptoms and causes
4809,is memory foam mattress good for you
4810,innerspring mattress reviews 2020
4811,will a queen comforter fit a full bed
4812,tempurpedic mattress odor removal
4813,temperature regulating mattress pad
4814,bamboo vs cotton mattress protector
4815,how to stop grinding teeth from stress
4816,top 10 best mattress brands
4817,how to fix a dip in a mattress
4818,what's the width of a california king bed
4819,king bed vs twin
4820,i ve been sweating in my sleep
4821,mattress sagging on edges
4822,craftmatic split king adjustable bed
4823,finding the best pillow
4824,best mattress for tummy sleepers
4825,i need a king size bed
4826,plastic mattress topper
4827,best mattress protector to keep you cool
4828,latex hybrid mattress reviews
4829,split king memory foam mattress topper
4830,what is the standard height of a queen size mattress
4831,can sleep apnea cause excessive sweating
4832,3 feet mattress
4833,best cheap medium firm mattress
4834,do you have to turn a tempurpedic mattress
4835,best mattress for heavy set side sleepers
4836,after how many years should you replace your mattress
4837,train yourself to sleep on your back
4838,difference between twin size and full size
4839,how many inches wide is a twin bed
4840,how to burn calories in your bedroom
4841,how many calories is ideal to burn a day
4842,bed bugs in latex mattress
4843,low cost king size beds
4844,size of king vs queen
4845,sleep on latex pure green topper
4846,full xl futon
4847,best type of pillow
4848,best rated twin mattress for adults
4849,how many calories do you burn in an hour
4850,best mattress topper for old spring mattress
4851,best queen bed frame reviews
4852,best position to sleep with adjustable bed
4853,best mattress for large couples
4854,why do we sleep talk
4855,a good pillow to sleep on
4856,best inexpensive innerspring mattress
4857,how can a bad mattress affect you
4858,how to make your bed cool in summer
4859,bleach mattress
4860,how big is an alaskan king bed
4861,what is king size and queen size bed
4862,calories burned while sedentary
4863,sleep better visco elastic memory foam mattress topper
4864,what size is a futon mattress
4865,is there a way to prevent sleep paralysis
4866,mattress hard top
4867,gel memory foam bed
4868,top high end mattresses
4869,hip pain from sleeping position
4870,why do people grind their teeth while sleeping
4871,best mattress for kyphosis
4872,60 bed size
4873,can you put polyurethane in the dryer
4874,pillow height calculator
4875,bed bigger than a single smaller than a double
4876,the difference between full and queen
4877,what are the dimensions of a full size mattress
4878,52 inch bed size
4879,difference between king mattress and california king mattress
4880,full bed compared to twin
4881,snoring while sleeping on stomach
4882,entire comfort pillow reviews
4883,can you use memory foam mattress without box spring
4884,labor day bed sales
4885,what size are split king sheets
4886,is single mattress same as twin
4887,bed causing lower back pain
4888,mattress coil density
4889,frame for mattress in a box
4890,how to wash down pillows in the washer
4891,do you need a box spring for a hybrid mattress
4892,best position for snoring
4893,shiki mat
4894,gel foam material
4895,full size mattress moving bag
4896,best lumbar pillow for sleeping
4897,how long and wide is a twin bed
4898,mattress for obese person
4899,how are mattresses made
4900,home classics memory foam gel pillow
4901,best pillow for watching tv in bed
4902,eastern king measurements
4903,how many feet is a california king bed
4904,how to fix body impressions in mattress
4905,cooling mattress pillow topper
4906,best non toxic memory foam mattress
4907,sleep number split king sheets on sale
4908,benefits of hot shower at night
4909,how to wake up to first alarm
4910,10 best mattresses in a box
4911,too soft of a mattress
4912,ways to wake up people
4913,what are pillow tops
4914,using slats instead of box spring
4915,best pillow for jaw clenching
4916,twin size bed and full size bed
4917,twin vs double bed
4918,memory foam smell removal
4919,queen bed in feet
4920,standard crib comforter size
4921,how to make a futon softer
4922,what is a gel mattress
4923,can t find a comfortable pillow
4924,position mattress
4925,cervical disc bulge sleeping position
4926,twin versus full bed dimensions
4927,is memory foam good for back
4928,are bed in a box mattresses good
4929,futon with coil spring mattress
4930,best bamboo mattress pad
4931,king mattress in a bag
4932,memory foam pillow smell
4933,bed frame two mattresses
4934,purple power base app
4935,best bed mattress for lower back pain
4936,cooling mattress pad for memory foam reviews
4937,traditional mattress
4938,pillow top memory foam mattress king
4939,king size queen size bed
4940,twin size adjustable bed base
4941,what size is two twin beds together
4942,how do you wake up without an alarm clock
4943,is california king same as king
4944,calories burned per hour
4945,can i use bleach on a mattress
4946,what do two twin beds make
4947,good mattress for side sleepers
4948,west elm quilt reviews
4949,15 year old mattress
4950,california king adjustable bed base
4951,foam sleeping pillows
4952,bed that slides under platform
4953,dobby blanket
4954,futon roll mattress
4955,sagging mattress
4956,is a full bed two twins
4957,how many calories do i burn a day without exercise
4958,adjustable bed best position
4959,how to get perfect sleep
4960,what causes you to sweat in your sleep
4961,best king size mattress for bad back
4962,how do memory foam pillows work
4963,greenguard certified mattress list
4964,purple hybrid premier 4 review
4965,standard queen size bed dimensions
4966,60 80 mattress size
4967,what is the size of a full xl mattress
4968,why do we sweat at night
4969,standard queen bed size cm
4970,how you get sleep paralysis
4971,can a full fit a twin
4972,do you need a box spring with mattress
4973,all latex vs hybrid mattress
4974,inexpensive firm mattress
4975,sheets that fit sleep number split king beds
4976,do i have sleep paralysis
4977,how to get a better night sleep
4978,how to sleep slipped disc
4979,why am i getting sweaty at night
4980,alzheimer patient talking in sleep
4981,hip pain when sleeping on side
4982,are two twin beds a king
4983,queen size mattress dubai
4984,how to stop gnashing your teeth
4985,most affordable mattress
4986,most comfortable futon to sleep on
4987,what happens to the body without sleep
4988,aslan mattress reviews
4989,heated foam mattress topper
4990,mattress in a box vs regular mattress
4991,what is the width of a king bed
4992,what is the meaning of sleep paralysis
4993,what's the size of a twin size mattress
4994,how many calories does your body burn per hour
4995,how to make a twin sheet fit a toddler bed
4996,dhp 6 coil futon mattress full available in multiple colors
4997,amazon mattress sale
4998,latex mattress comparison
4999,gel or memory foam
5000,what is medium hybrid mattress
5001,best bed size for couples
5002,eco comfort mattress reviews
5003,king size bed with two twin mattresses
5004,mattress cleaner spray
5005,how to get rid of old mattress
5006,labor day mattress deals
5007,the most comfortable futon
5008,is king size bed square
5009,avocado mattress topper
5010,full size vs queen dimensions
5011,how much is a california king purple mattress
5012,what's the size difference between a queen and a king
5013,good pillows to sleep on
5014,how big is a king size bed in feet
5015,long memory foam pillow
5016,how to keep mattress pad from sliding
5017,queen comforter inches
5018,best king size mattress in a box
5019,pure echo mattress review
5020,whats a good pillow for neck pain
5021,cal king adjustable bed frame
5022,stop grinding teeth in your sleep
5023,cal king mattress in a box
5024,whats the difference between a california king and a king
5025,how to sanitize bed pillows
5026,body tech mattress
5027,king size mattress size in inches
5028,what is the mattress size for a full bed
5029,futon beds with thick mattress
5030,mechanical bed base
5031,what is sleep paralysis
5032,how to make a mattress last longer
5033,cool gel pillow top mattress pad
5034,will a king fit a queen
5035,harmony pillow
5036,did we lose or gain an hour of sleep
5037,coop homegoods pillow review
5038,mattress under
5039,do two twins equal a king mattress
5040,latex mattress too hot
5041,full length mattress
5042,best adjustable mattress for back pain
5043,two twin beds vs queen
5044,what causes a mattress to sag
5045,will dry cleaners wash comforters
5046,box spring no springs
5047,memory foam mattress california
5048,mattress toppers that are not hot
