,Keyword
2210,split king mattress measurements
2211,split king adjustable base reviews
2212,memory foam mattress makes me sweat
2213,full size mattress width
2214,top rated mattresses for back and hip pain
2215,how often do you rotate a memory foam mattress
2216,twin xl bed frame
2217,hybrid vs all foam mattress
2218,burn calories in your sleep
2219,best latex beds
2220,spring bed vs memory foam
2221,bed mattress sizes
2222,top 10 memory foam mattresses
2223,how to cool down a foam mattress
2224,split king width
2225,clean mattress stains
2226,memory foam bed reviews
2227,what is the best adjustable bed and mattress
2228,how much does it cost to dry clean a comforter
2229,nacreous mattress pad
2230,what is queen size
2231,best hybrid bed for side sleepers
2232,what is a twin xl
2233,why we drool
2234,why we drool while sleeping
2235,full king
2236,king bed or california king
2237,how many calories does the body burn a day
2238,twin mattress size in cm
2239,split bed
2240,how to make my bed stop moving
2241,can a hybrid mattress be used with an adjustable base
2242,what is a split king mattress set
2243,how to keep tempurpedic mattress cooler
2244,what's the best memory foam mattress
2245,how big is a california king compared to a king
2246,zoma mattress
2247,can old mattress cause hip pain
2248,top rated memory foam mattress
2249,what are the dimensions of a queen size comforter
2250,memory foam mattress for side sleepers
2251,what type of mattress is best for a toddler
2252,best bed in box reviews
2253,full size mattress vs twin
2254,is my mattress causing hip pain
2255,california king vs alaskan king
2256,best gel bed
2257,vacuum seal bag for twin mattress
2258,what is the lifetime of a mattress
2259,single mattress size in feet
2260,can you wash a memory foam mattress cover
2261,cooling gel pad for bed
2262,best rated king size adjustable beds
2263,pillow top mattress pad vs memory foam
2264,rotate memory foam mattress
2265,foam mattress brands
2266,best split king adjustable bed frame
2267,do you need to rotate a memory foam mattress
2268,dual split king mattress
2269,who makes the best mattress in a box
2270,what size is a king size mattress
2271,best budget memory foam mattress
2272,will a memory foam topper help a sagging mattress
2273,best innerspring mattress for side sleepers 2017
2274,pillow top bed
2275,bamboo cooling mattress pad
2276,best mattress for big people
2277,standard twin bed dimensions
2278,pocket coil futon mattress reviews
2279,single mattress
2280,spin mattress
2281,how to keep metal bed frame from moving
2282,full bed size in cm
2283,best medium mattress in a box
2284,best pressure relieving mattress
2285,do memory foam mattresses need to be rotated
2286,how to make a foam mattress cooler
2287,tempurpedic pillow cleaning instructions
2288,split king adjustable mattress reviews
2289,best mattress for hip and low back pain
2290,futon bed with mattress
2291,sleeping on your back
2292,gel mattress vs spring
2293,gel mattress vs spring
2294,difference between king and queen size bed
2295,best king size adjustable base
2296,bed size bigger than california king
2297,best and affordable mattress
2298,how much is a queen mattress
2299,what happens after 48 hours of no sleep
2300,best firm foam pillow
2301,how to keep a bed frame from sliding
2302,california queen bed size
2303,is a memory foam or hybrid mattress better
2304,mattress blog
2305,best mattress for back problems
2306,what causes drooling in sleep
2307,rotate matress
2308,difference in queen and king bed
2309,memory foam mattress bag
2310,36 hours no sleep side effects
2311,best mattress for hip osteoarthritis
2312,difference king size and california king
2313,what's bigger than a cal king
2314,highest rated cooling mattress topper
2315,what's the difference between gel foam and memory foam
2316,best natural mattress 2015
2317,cheap and best mattress
2318,full vs full xl
2319,how long can you keep a mattress
2320,best memory foam contour pillow reviews
2321,why do i drool so much
2322,best memory foam pillow brands
2323,top hybrid mattresses
2324,king size bed vs california king dimensions
2325,restore memory foam
2326,stop grinding teeth
2327,what are the dimensions of a twin size bed
2328,how big is a split king bed
2329,why drool while sleeping
2330,bed vacuum bag
2331,queen size adjustable bed frame
2332,twin mattress size in inches
2333,best type of mattress for side sleepers
2334,futon mattress guide
2335,best medium firm latex mattress
2336,best rated mattress for toddlers
2337,king size vs queen size
2338,is memory foam mattress good
2339,queen size mattress measurement cm
2340,california king bed length
2341,hybrid mattress vs memory foam mattress
2342,mattress bed bug eggs
2343,is it bad to drool in your sleep
2344,do adjustable beds come with mattresses
2345,best king size mattress with adjustable base
2346,queen vs king dimensions
2347,is drooling in sleep normal
2348,how long is a twin size bed
2349,types of blankets
2350,best adjustable king size mattress
2351,vacuumed sealed mattress
2352,hybrid matress
2353,split california king vs california king
2354,california king vs california
2355,california king length
2356,what is the best mattress for bad back and hips
2357,what's the difference between twin and twin xl
2358,drooling in sleep reasons
2359,best memory foam mattress set
2360,best mattress for 5 year old
2361,how often should you turn a memory foam mattress
2362,charcoal gel memory foam vs memory foam
2363,vacuflat mattress bag
2364,best foam mattress for side sleepers
2365,how long can i go without sleep
2366,what causes you to drool in your sleep
2367,what size is a single mattress in cm
2368,difference in king & california king
2369,how many hours can i go without sleep
2370,split king bed measurements
2371,king size bed dimensions in inches
2372,how large is a california king bed
2373,what mattress is good for scoliosis
2374,recommended lifespan of a mattress
2375,drooling while sleeping why
2376,velcro mattress straps
2377,size of queen mattress in feet
2378,memory foam pillow which side
2379,best innerspring mattress for side sleepers
2380,how long can someone stay awake
2381,two twin xl beds make a
2382,mattress dimensions chart
2383,is a king two twins
2384,high density foam mattress
2385,king size bed vacuum bag
2386,memory foam mattress storage bag
2387,beds that raise and lower
2388,king size cooling mattress pad
2389,king bed and california king
2390,amerisleep pillow
2391,double mattress dimensions
2392,mattress size measurements
2393,what causes someone to drool while sleeping
2394,is memory foam good
2395,king vs cal king sheets
2396,what is king and california king
2397,whats a california king bed
2398,water mattress topper
2399,why does a person drool when sleeping
2400,bed moves away from wall
2401,what are the dimensions of a king size bed
2402,twin matress for kids
2403,dimensions of a split king bed
2404,memory foam mattress or hybrid
2405,mattress reviews for side sleepers
2406,what makes you drool at night
2407,is a gel memory foam mattress good
2408,how to destroy a mattress
2409,best mattress that raises and lowers
2410,best budget mattress review
2411,best hybrid mattress reviews
2412,cool gel vs memory foam
2413,2 twin xl vs king
2414,top rated cal king mattresses
2415,what is the difference between twin and twin xl
2416,how to wash tempurpedic pillow
2417,top rated foam mattress
2418,difference between foam and latex mattress
2419,how long is a twin xl mattress
2420,cal king dimensions mattress
2421,nuform affinity mattress reviews
2422,what makes you drool in your sleep
2423,adjustable innerspring mattresses
2424,memory foam futon mattress full size
2425,full size mattress size in feet
2426,full size mattress dimensions in inches
2427,queen size bed in cm
2428,difference between king and california king sheets
2429,how often should i rotate my memory foam mattress
2430,what is the best adjustable base
2431,vacuum sealed bed
2432,good queen mattress
2433,how many calories do you burn while awake
2434,how long can the human body stay awake
2435,twin bed size in inches
2436,how to fix memory foam mattress tear
2437,vacuum seal bag for queen size mattress
2438,best mattress for athletes 2019
2439,best adjustable bed base with massage
2440,best rated innerspring mattress 2017
2441,flip and rotate mattress
2442,best mattress under 1000
2443,best kind of mattress for child
2444,what size is a cal king bed
2445,best hybrid mattress for combo sleepers
2446,full bed vs queen
2447,dimensions of king size bed vs cal king
2448,memory foam mattress companies
2449,compare king to california king
2450,how to make tempurpedic bed cooler
2451,best futon mattress for back pain
2452,shower before bed
2453,queen mattress width
2454,best futon mattress for sofa
2455,best cooling mattress pad for memory foam
2456,vacuum storage bag for foam mattress topper
2457,how many feet is a queen size bed
2458,whats a comforter
2459,how to keep your mattress cool
2460,how do i keep my memory foam mattress from sliding
2461,best zero gravity bed
2462,what's the size of a california king mattress
2463,adjustable bed frame queen
2464,small single bed with mattress
2465,best shredded memory foam pillow
2466,best memory foam mattress for the money
2467,best rated memory foam mattress
2468,what mattresses can be used with adjustable base
2469,king size bed dimensions vs queen
2470,queen size mattress dimensions in feet
2471,natural element hybrid mattress reviews
2472,how wide is a california king mattress
2473,how wide is a california king mattress
2474,early wake up call
2475,what is a good quality mattress
2476,how to get rid of bed bugs in the mattress
2477,twin versus full
2478,should i flip my mattress
2479,best mattress for cool sleeping
2480,latex king mattress
2481,gel mattress vs hybrid
2482,how to fill gap between mattress and bed frame
2483,best mattress for hip bursitis
2484,latex over foam mattress reviews
2485,california king compared to king bed
2486,best firm hybrid mattress
2487,how to keep mattress cool
2488,best cooling mattress protector
2489,bed sizes in inches
2490,top gel foam mattress
2491,memory foam cleaner
2492,memory foam cancer
2493,bed in box mattress reviews
2494,memory foam density guide
2495,difference between king vs california king
2496,what to do when having sleep paralysis
2497,where to buy wyoming king mattress
2498,green choice mattress warranty
2499,high density mattress topper
2500,how many calories should we burn a day
2501,high quality cotton blankets
2502,where to get plastic wrap for mattress
2503,6 foot mattress
2504,best way to stop grinding teeth while sleeping
2505,average comforter price
2506,difference between mattress pad and mattress cover
2507,queen compared to full
2508,full size bed twin comparison
2509,disadvantages of adjustable air mattress beds
2510,copper infused latex
2511,is a futon full or queen
2512,whats the difference between twin and twin xl sheets
2513,why do i sweat every night
2514,disposing of furniture with bed bugs
2515,layla mattress warranty
2516,non toxic foam mattress
2517,as3 mattress
2518,dual side adjustable beds
2519,best type of bed for lower back pain
2520,viscosoft 4 inch pillow top memory foam mattress topper queen
2521,cooling topper for king size bed
2522,schedule wake up call online
2523,heating and cooling mattress topper
2524,clean spots off mattress
2525,tulo mattress medium
2526,red nomad memory foam mattress topper
2527,split king adjustable bed and mattress
2528,botanical bliss natural latex mattress reviews
2529,will a mattress topper help an old mattress
2530,what kind of mattress should a side sleeper get
2531,gel futon mattress
2532,how many calories do we burn a day without exercise
2533,best amazon mattress for side sleepers
2534,what is a gel memory foam mattress
2535,hard mattress hip pain
2536,large foam mattress
2537,fully adjustable bed frame
2538,best lasting mattress
2539,what are the dimensions of a queen bed in feet
2540,memory foam reviews
2541,how to stop grinding your teeth at night
2542,sweating through clothes every night
2543,how to clean the stains from mattress
2544,size between full and twin
2545,increased drooling
2546,best adjustable air beds reviews
2547,latex foam bed prices
2548,adjustable base vs box spring
2549,how to freshen a mattress
2550,is firm mattress best for back pain
2551,king or queen
2552,best choice memory foam mattress
2553,best bed frame for mattress and box spring
2554,what are the different mattress sizes
2555,red nomad mattress protector
2556,gerd night sweats
2557,what's bigger a queen or king bed
2558,queen length vs full
2559,best position to sleep on adjustable bed
2560,do you need a mattress topper
2561,how many inches wide is a queen bed
2562,full mattress width inches
2563,how many coils in a good queen mattress
2564,best firm king mattress under 1000
2565,full twin size bed
2566,needbox
2567,twin vs twin xl vs full
2568,gel foam mattress cover
2569,which memory foam mattress
2570,what's the measurements on a full size mattress
2571,is extra firm mattress good for back pain
2572,what is the best twin xl mattress
2573,do mattress toppers really work
2574,kids bed with mattress
2575,yellow foam mattress
2576,buffy duvet insert
2577,queen mattress size chart
2578,queen size in feet
2579,red nomad mattress encasement
2580,disinfect throw pillows
2581,can you put a down pillow in the washing machine
2582,difference between memory foam mattresses
2583,does a foam mattress require a boxspring
2584,percale tencel fabric sheets
2585,types of mattresses brands
2586,what are the dimensions of a queen size mattress
2587,best bed in a box hybrid
2588,best bed in a box hybrid
2589,top rated coil spring mattress
2590,what is the most comfortable soft mattress
2591,change mattress every
2592,deep sleep mattress topper review
2593,foam mattress dubai
2594,best way to dry out a mattress
2595,full queen size blanket dimensions
2596,how many calories does an average man burn per day
2597,will a king size bed set fit a california king
2598,how many feet is a twin size mattress
2599,top ten mattress toppers
2600,cheap adjustable bed frame
2601,how can i stop drooling at night
2602,king size flat sheet dimensions in feet
2603,what is a standard double mattress size
2604,king size bed bigger
2605,spot cleaning a mattress
2606,amerisleep as5 review
2607,how many calories to maintain 130 lbs
2608,california king size vs regular king
2609,best duvet inserts for warm weather
2610,suggested mattress for back pain
2611,good memory foam toppers
2612,split queen size adjustable mattress
2613,futon mattress only
2614,green memory foam mattress topper
2615,how much bigger is a california king than king
2616,eco friendly twin bed mattress
2617,best online mattress cheap
2618,allswell mattress adjustable base
2619,average width of a twin mattress
2620,mattress out of a box
2621,cheap mattress for heavy person
2622,keeping split king mattresses together
2623,twin xl mattress cost
2624,organic cooling mattress topper
2625,is a king size bed wider or longer
2626,twin vs full bed for kids
2627,cal king size mattress size
2628,cal king size mattress size
2629,best pillow position for sleep
2630,best mattress pad for memory foam mattress
2631,memory foam mattress topper sizes
2632,how big is a texas king bed
2633,latex mattress latex allergy
2634,how many calories do i burn an hour
2635,best value bed frame
2636,bed too soft back problems
2637,what is a firm mattress
2638,can i wash my down comforter in the washer
2639,purple harmony pillow king size
2640,california king to king
2641,outlast cooling mattress pad
2642,disadvantages of memory foam mattress
2643,futon mattress 8 inch thick
2644,can you put down pillows in the washing machine
2645,where can i buy a california king mattress
2646,can t sleep on my back
2647,difference between twin xl and full
2648,charcoal mattress benefits
2649,best memory foam floor mattress
2650,where to buy an alaskan king size bed
2651,how many calories do i burn naturally in a day
2652,what happens when you go 24 hours without sleep
2653,why do i sometimes wake up covered in sweat
2654,what's the measurements of a queen size mattress
2655,what are the measurements of a cal king
2656,what are the measurements of a cal king
2657,non memory foam
2658,how firm should a mattress be for a child
2659,how to keep sleep number bed from sliding
2660,viscosoft topper
2661,full v queen size
2662,best mattress for back pain relief
2663,alaskan king bed price
2664,good deals on queen mattresses
2665,tempurpedic mattress heat issues
2666,the most comfortable mattress review
2667,how much is a craftmatic adjustable bed
2668,are mattresses in a box worth it
2669,difference in memory foam
2670,king size gel mattress topper
2671,what's a mattress in a box
2672,sleep time schedule calculator
2673,calories used at rest
2674,cool gel foam mattress
2675,dimensions of a king bed vs queen
2676,how to not sweat in sleep
2677,how often should you get a new box spring
2678,adjustable bed reviews 2019
2679,twin hospital bed mattress
2680,mattress topper feather vs foam
2681,best foam mattress australia
2682,infant bed dimensions
2683,best pillow for side and back sleepers with neck pain
2684,what is the difference between foam and latex mattress
2685,where can i buy eastern king sheets
2686,do you have to flip memory foam mattress
2687,best pillow for herniated disc
2688,yellow memory foam mattress topper
2689,best medium queen mattress
2690,should i sleep with one pillow or two
2691,best sleeping position for arthritic hips
2692,twin size bed width
2693,pressure point relief mattress topper
2694,best mattress for back pain and cooling
2695,best adjustable beds 2014
2696,best mattress for fibromyalgia and back pain
2697,best mattress for anterior pelvic tilt
2698,best hybrid and innerspring mattresses
2699,what is the standard width of a queen size bed
2700,original mattress factory latex bed reviews
2701,very best mattress review
2702,what are the standard dimensions of a king size mattress
2703,best pillow for rheumatoid arthritis
2704,put two twin beds together king
2705,good innerspring mattress
2706,full size bed big enough for two
2707,the right way to sleep on your back
2708,shower before bed or in the morning
2709,best deal on queen mattress
2710,what is the length of a queen mattress
2711,where can i buy a latex mattress
2712,how many people can fit on a twin bed
2713,best return policies in the mattress industry
2714,best mattress for chronic pain
2715,cool ways to make your bed
2716,best quality lowest price mattress
2717,the biggest mattress you can buy
2718,twin cooling mattress topper
2719,does a firm mattress cause back pain
2720,benefits of innerspring mattresses
2721,what surfaces do bed bugs live on
2722,mattress on the floor style
2723,choosing a memory foam mattress
2724,latex mattress off gassing
2725,plastic bag roll diy
2726,memory foam mattress topper cleaning instructions
2727,best therapeutic beds
2728,how long will a memory foam mattress last
2729,bet topper
2730,dunlop mattress double bed
2731,why do i sleep too much
2732,best down bed topper
2733,what to use to stop grinding teeth at night
2734,will a twin xl fit a full
2735,sleep paralysis dark presence
2736,best position to sleep in adjustable bed
2737,twin size and queen size
2738,gel top mattress pad
2739,texas king vs california king
2740,how many inches is a twin size mattress
2741,ultra plush mattress reviews
2742,bunkie board vs plywood
2743,measurements of a queen size bed duvet
2744,is an eastern king a king bed
2745,what makes people talk in their sleep
2746,get sweat smell out of mattress
2747,does baking soda get rid of bed bugs
2748,where to buy bed in a box
2749,ways to get rid of bed bugs permanently
2750,how many days can you stay awake
2751,how long do i need to sleep calculator
2752,firm vs soft mattress
2753,whats an innerspring mattress
2754,what goes over a mattress
2755,foam for under mattress
2756,how to wash your comforter
2757,best medium firm memory foam mattress
2758,nolah bed reviews
2759,gap between mattress and bed frame
2760,select a side molded memory foam pillow
2761,how to get on a sleep schedule
2762,how to deal with insomnia
2763,cotton mattress vs memory foam
2764,size in cm of double bed
2765,can i use 2 mattresses instead of a box spring
2766,dimensions of the king size bed
2767,memory foam pieces to buy
2768,what's the best thing to get rid of bed bugs
2769,what is a good medium firm mattress
2770,best mattress to avoid back pain
2771,best mattress for a large person
2772,helix best hybrid mattress for side sleepers
2773,standard queen king pillow sizes
2774,best california king mattress under $1000
2775,matress size full
2776,is a full size bed big enough for 2 adults
2777,what is an adjustable base for mattress
2778,full size bed compared to twin size
2779,wake up easier
2780,latex foam vs memory foam
2781,my craftmatic bed prices
2782,need box spring for memory foam mattress
2783,best mattress deals memorial day
2784,calories hours
2785,best way to sleep herniated disc
2786,how to wash a mattress
2787,1 inch memory foam topper reviews
2788,twin xl bed dimensions in cm
2789,mattress topper to help back pain
2790,beds that raise
2791,replacement behavior for teeth grinding
2792,king size motorized bed
2793,difference between mattress protector and mattress topper
2794,how to keep two single mattresses together
2795,twin xl mattress and frame
2796,anti slip pads for beds
2797,best toddler mattress reviews
2798,best hybrid mattress for back pain
2799,can you fully get rid of bed bugs
2800,best affordable box mattress
2801,difference between king bed and california king bed
2802,why does head sweat when sleeping
2803,mold between mattress and box spring
2804,flip over pillow top mattress
2805,queen matress cheap
2806,why do you get sleep paralysis
2807,soft memory foam mattress
2808,mattress cleaner stain remover
2809,adjustable queen bed with mattress
2810,comfort tech serene foam 2 mattress topper
2811,what is a california king bed vs a king bed
2812,what happens when you have sleep paralysis
2813,why do i swear in my sleep
2814,can polyurethane cause cancer
2815,organic mattress comparison
2816,temperature regulating mattress
2817,exceptionalsheets latex pillow
2818,triangle shaped mattress
2819,memory foam mattress box spring needed
2820,sleep calculator age
2821,positions to prevent snoring
2822,single bed dimensions
2823,what can cause you to sweat at night
2824,alarm clock for people who dont wake up
2825,queen bed versus king bed size
2826,california king mattress size in cm
2827,futon mattress for back pain
2828,hevea bliss review
2829,all memory foam mattress
2830,memory foam solutions mattress topper
2831,should i buy a hybrid mattress
2832,stop bed slipping on wooden floor
2833,futon mattress dimensions
2834,how much is a king mattress
2835,i sleepwalk every night
2836,best queen size extra firm mattress
2837,best bed for heavy people
2838,zero gravity sleep position
2839,best pillow for combination side and stomach sleepers
2840,is sleep paralysis real
2841,adjustable beds direct manufacturing
2842,plant based memory foam topper
2843,big is a queen size bed
2844,can bed bugs live on foam mattresses
2845,northern lights hybrid mattress review
2846,how many calories your body burns a day
2847,purple mattress for fibromyalgia
2848,where to buy mattress storage bags
2849,what type of bed is best for a heavy person
2850,if i need to wake up at 7
2851,pillow to reduce bruxism
2852,what time does sleep paralysis occur
2853,gols and gots certified mattresses
2854,attach headboard to adjustable bed frame
2855,how much to spend on a mattress
2856,best mattress for heavy person
2857,how big is a full size bed in inches
2858,roll away mattress topper
2859,can king size sheets fit a queen size bed
2860,full size adjustable bed frame
2861,queen size cover measurements
2862,size of queen matress
2863,best firm sleeping pillow
2864,double bed vs queen bed
2865,can a pillow top mattress be flipped over
2866,different queen size beds
2867,thick futon mattress
2868,mattress with motion isolation
2869,split bed frame
2870,hops natural muscle relaxant
2871,queen adjustable base split
2872,best mattress topper for firm bed
2873,california king bed adjustable
2874,botanical latex mattress
2875,fix sleep cycle
2876,how can i wake up on time
2877,recovr mattress reviews
2878,are memory foam mattresses good for your back
2879,full size metal bed frame with a double ended attachment
2880,best delivery mattress company
2881,best mattress type for side and stomach sleepers
2882,purple mattress weight limit
2883,what is the size difference between twin and twin xl
2884,keetsa twin mattress
2885,what are dimensions of a king bed
2886,how to get rid of yellow stains on mattress
2887,best extra firm mattress
2888,giant plastic bags for moving
2889,what's the largest king size bed
2890,best mattress for back pain reviews
2891,how you burn calories
2892,best adjustable bed for back pain
2893,mattress that you can adjust
2894,how comfortable are japanese futons
2895,can you dry pillows in the dryer
2896,the best mattress made
2897,best mattress topper reviews
2898,even temp mattress pad
2899,what is the width of a full size bed
2900,standard width of king size bed
2901,types of foam mattress
2902,shikibuton bed frame
2903,athletic king size bed
2904,different kinds of sleep paralysis
2905,length of twin bed xl
2906,memory foam  
2907,best most affordable mattress
2908,best gel foam mattress topper 2019
2909,ac mattress pad
2910,full size crib mattress dimensions
2911,vacuum mattress
2912,how big is a king size bed in inches
2913,bedding for seniors
2914,how many feet wide is a king size bed
2915,adjustable beds health
2916,bamboo sleep memory foam topper
2917,japanese cotton mattress
